"No.","Time","Source","Destination","Protocol","Length","Info"
"1","0.000000000","VMware_7a:70:0b","Broadcast","ARP","42","Who has 192.168.100.11? Tell 192.168.100.10"
"2","0.003265217","VMware_73:39:c1","VMware_7a:70:0b","ARP","60","192.168.100.11 is at 00:0c:29:73:39:c1"
"3","0.120378576","VMware_7a:70:0b","Broadcast","ARP","42","Who has 192.168.100.12? Tell 192.168.100.10"
"4","0.121425825","VMware_48:a5:6d","VMware_7a:70:0b","ARP","60","192.168.100.12 is at 00:0c:29:48:a5:6d"
"5","0.243535887","VMware_7a:70:0b","Broadcast","ARP","42","Who has 192.168.100.11? Tell 192.168.100.10"
"6","0.243944565","VMware_73:39:c1","VMware_7a:70:0b","ARP","60","192.168.100.11 is at 00:0c:29:73:39:c1"
"7","0.307966390","192.168.100.10","192.168.100.11","TCP","58","43307  >  443 [SYN] Seq=0 Win=1024 Len=0 MSS=1460"
"8","0.308042514","192.168.100.10","192.168.100.11","TCP","58","43307  >  21 [SYN] Seq=0 Win=1024 Len=0 MSS=1460"
"9","0.308066200","192.168.100.10","192.168.100.11","TCP","58","43307  >  22 [SYN] Seq=0 Win=1024 Len=0 MSS=1460"
"10","0.308084996","192.168.100.10","192.168.100.11","TCP","58","43307  >  80 [SYN] Seq=0 Win=1024 Len=0 MSS=1460"
"11","0.308104458","192.168.100.10","192.168.100.11","TCP","58","43307  >  3306 [SYN] Seq=0 Win=1024 Len=0 MSS=1460"
"12","0.308122268","192.168.100.10","192.168.100.11","TCP","58","43307  >  8080 [SYN] Seq=0 Win=1024 Len=0 MSS=1460"
"13","0.309077953","192.168.100.11","192.168.100.10","TCP","60","443  >  43307 [SYN, ACK] Seq=0 Ack=1 Win=64240 Len=0 MSS=1460"
"14","0.309314938","192.168.100.10","192.168.100.11","TCP","54","43307  >  443 [RST] Seq=1 Win=0 Len=0"
"15","0.309369612","192.168.100.11","192.168.100.10","TCP","60","21  >  43307 [SYN, ACK] Seq=0 Ack=1 Win=64240 Len=0 MSS=1460"
"16","0.309369717","192.168.100.11","192.168.100.10","TCP","60","22  >  43307 [SYN, ACK] Seq=0 Ack=1 Win=64240 Len=0 MSS=1460"
"17","0.309369751","192.168.100.11","192.168.100.10","TCP","60","80  >  43307 [SYN, ACK] Seq=0 Ack=1 Win=64240 Len=0 MSS=1460"
"18","0.309369784","192.168.100.11","192.168.100.10","TCP","60","3306  >  43307 [SYN, ACK] Seq=0 Ack=1 Win=64240 Len=0 MSS=1460"
"19","0.309369818","192.168.100.11","192.168.100.10","TCP","60","8080  >  43307 [SYN, ACK] Seq=0 Ack=1 Win=64240 Len=0 MSS=1460"
"20","0.309381354","192.168.100.10","192.168.100.11","TCP","54","43307  >  21 [RST] Seq=1 Win=0 Len=0"
"21","0.309403779","192.168.100.10","192.168.100.11","TCP","54","43307  >  22 [RST] Seq=1 Win=0 Len=0"
"22","0.309422406","192.168.100.10","192.168.100.11","TCP","54","43307  >  80 [RST] Seq=1 Win=0 Len=0"
"23","0.309699823","192.168.100.10","192.168.100.11","TCP","54","43307  >  3306 [RST] Seq=1 Win=0 Len=0"
"24","0.309720039","192.168.100.10","192.168.100.11","TCP","54","43307  >  8080 [RST] Seq=1 Win=0 Len=0"
"25","0.367522089","192.168.100.10","192.168.100.11","TCP","74","43638  >  9999 [SYN] Seq=0 Win=64240 Len=0 MSS=1460 SACK_PERM TSval=3053784055 TSecr=0 WS=512"
"26","0.368317360","192.168.100.11","192.168.100.10","TCP","74","9999  >  43638 [SYN, ACK] Seq=0 Ack=1 Win=65160 Len=0 MSS=1460 SACK_PERM TSval=2229775399 TSecr=3053784055 WS=128"
"27","0.368795713","192.168.100.10","192.168.100.11","TCP","66","43638  >  9999 [ACK] Seq=1 Ack=1 Win=64512 Len=0 TSval=3053784056 TSecr=2229775399"
"28","0.368950258","192.168.100.10","192.168.100.11","TCP","3688","43638  >  9999 [PSH, ACK] Seq=1 Ack=1 Win=64512 Len=3622 TSval=3053784057 TSecr=2229775399"
"29","0.369251832","192.168.100.10","192.168.100.11","TCP","66","43638  >  9999 [FIN, ACK] Seq=3623 Ack=1 Win=64512 Len=0 TSval=3053784057 TSecr=2229775399"
"30","0.370244628","192.168.100.11","192.168.100.10","TCP","66","9999  >  43638 [ACK] Seq=1 Ack=3623 Win=64128 Len=0 TSval=2229775402 TSecr=3053784057"
"31","0.372619461","192.168.100.11","192.168.100.10","TCP","66","9999  >  43638 [FIN, ACK] Seq=1 Ack=3624 Win=64128 Len=0 TSval=2229775404 TSecr=3053784057"
"32","0.372649157","192.168.100.10","192.168.100.11","TCP","66","43638  >  9999 [ACK] Seq=3624 Ack=2 Win=64512 Len=0 TSval=3053784060 TSecr=2229775404"
"33","0.375672565","192.168.100.11","192.168.100.10","TCP","74","56664  >  8888 [SYN] Seq=0 Win=64240 Len=0 MSS=1460 SACK_PERM TSval=2229775407 TSecr=0 WS=128"
"34","0.375702226","192.168.100.10","192.168.100.11","TCP","74","8888  >  56664 [SYN, ACK] Seq=0 Ack=1 Win=65160 Len=0 MSS=1460 SACK_PERM TSval=3053784063 TSecr=2229775407 WS=512"
"35","0.375981851","192.168.100.11","192.168.100.10","TCP","66","56664  >  8888 [ACK] Seq=1 Ack=1 Win=64256 Len=0 TSval=2229775407 TSecr=3053784063"
"36","0.377840937","192.168.100.11","192.168.100.10","TCP","265","56664  >  8888 [PSH, ACK] Seq=1 Ack=1 Win=64256 Len=199 TSval=2229775409 TSecr=3053784063"
"37","0.377869492","192.168.100.10","192.168.100.11","TCP","66","8888  >  56664 [ACK] Seq=1 Ack=200 Win=65024 Len=0 TSval=3053784066 TSecr=2229775409"
"38","0.377908063","192.168.100.11","192.168.100.10","TCP","66","56664  >  8888 [FIN, ACK] Seq=200 Ack=1 Win=64256 Len=0 TSval=2229775409 TSecr=3053784063"
"39","0.377969009","192.168.100.10","192.168.100.11","TCP","66","8888  >  56664 [FIN, ACK] Seq=1 Ack=201 Win=65024 Len=0 TSval=3053784066 TSecr=2229775409"
"40","0.378100432","192.168.100.11","192.168.100.10","TCP","66","56664  >  8888 [ACK] Seq=201 Ack=2 Win=64256 Len=0 TSval=2229775410 TSecr=3053784066"
"41","0.423885973","VMware_7a:70:0b","Broadcast","ARP","42","Who has 192.168.100.12? Tell 192.168.100.10"
"42","0.424221005","VMware_48:a5:6d","VMware_7a:70:0b","ARP","60","192.168.100.12 is at 00:0c:29:48:a5:6d"
"43","0.515783443","192.168.100.10","192.168.100.12","TCP","58","56449  >  443 [SYN] Seq=0 Win=1024 Len=0 MSS=1460"
"44","0.515850026","192.168.100.10","192.168.100.12","TCP","58","56449  >  8080 [SYN] Seq=0 Win=1024 Len=0 MSS=1460"
"45","0.515877801","192.168.100.10","192.168.100.12","TCP","58","56449  >  22 [SYN] Seq=0 Win=1024 Len=0 MSS=1460"
"46","0.515898303","192.168.100.10","192.168.100.12","TCP","58","56449  >  3306 [SYN] Seq=0 Win=1024 Len=0 MSS=1460"
"47","0.515920800","192.168.100.10","192.168.100.12","TCP","58","56449  >  80 [SYN] Seq=0 Win=1024 Len=0 MSS=1460"
"48","0.515944697","192.168.100.10","192.168.100.12","TCP","58","56449  >  21 [SYN] Seq=0 Win=1024 Len=0 MSS=1460"
"49","0.516638495","192.168.100.12","192.168.100.10","TCP","60","443  >  56449 [SYN, ACK] Seq=0 Ack=1 Win=64240 Len=0 MSS=1460"
"50","0.516638752","192.168.100.12","192.168.100.10","TCP","60","8080  >  56449 [SYN, ACK] Seq=0 Ack=1 Win=64240 Len=0 MSS=1460"
"51","0.516686544","192.168.100.10","192.168.100.12","TCP","54","56449  >  443 [RST] Seq=1 Win=0 Len=0"
"52","0.517023311","192.168.100.10","192.168.100.12","TCP","54","56449  >  8080 [RST] Seq=1 Win=0 Len=0"
"53","0.517080583","192.168.100.12","192.168.100.10","TCP","60","22  >  56449 [SYN, ACK] Seq=0 Ack=1 Win=64240 Len=0 MSS=1460"
"54","0.517080690","192.168.100.12","192.168.100.10","TCP","60","3306  >  56449 [SYN, ACK] Seq=0 Ack=1 Win=64240 Len=0 MSS=1460"
"55","0.517080749","192.168.100.12","192.168.100.10","TCP","60","80  >  56449 [SYN, ACK] Seq=0 Ack=1 Win=64240 Len=0 MSS=1460"
"56","0.517080782","192.168.100.12","192.168.100.10","TCP","60","21  >  56449 [SYN, ACK] Seq=0 Ack=1 Win=64240 Len=0 MSS=1460"
"57","0.517107513","192.168.100.10","192.168.100.12","TCP","54","56449  >  22 [RST] Seq=1 Win=0 Len=0"
"58","0.517130346","192.168.100.10","192.168.100.12","TCP","54","56449  >  3306 [RST] Seq=1 Win=0 Len=0"
"59","0.517175785","192.168.100.10","192.168.100.12","TCP","54","56449  >  80 [RST] Seq=1 Win=0 Len=0"
"60","0.517199323","192.168.100.10","192.168.100.12","TCP","54","56449  >  21 [RST] Seq=1 Win=0 Len=0"
"61","0.598455752","192.168.100.10","192.168.100.12","TCP","74","44034  >  9999 [SYN] Seq=0 Win=64240 Len=0 MSS=1460 SACK_PERM TSval=4010906430 TSecr=0 WS=512"
"62","0.598854748","192.168.100.12","192.168.100.10","TCP","74","9999  >  44034 [SYN, ACK] Seq=0 Ack=1 Win=65160 Len=0 MSS=1460 SACK_PERM TSval=411813625 TSecr=4010906430 WS=128"
"63","0.599004904","192.168.100.10","192.168.100.12","TCP","66","44034  >  9999 [ACK] Seq=1 Ack=1 Win=64512 Len=0 TSval=4010906431 TSecr=411813625"
"64","0.599103483","192.168.100.10","192.168.100.12","TCP","3706","44034  >  9999 [PSH, ACK] Seq=1 Ack=1 Win=64512 Len=3640 TSval=4010906431 TSecr=411813625"
"65","0.599185957","192.168.100.10","192.168.100.12","TCP","66","44034  >  9999 [FIN, ACK] Seq=3641 Ack=1 Win=64512 Len=0 TSval=4010906431 TSecr=411813625"
"66","0.600149451","192.168.100.12","192.168.100.10","TCP","66","9999  >  44034 [ACK] Seq=1 Ack=3641 Win=64128 Len=0 TSval=411813626 TSecr=4010906431"
"67","0.602290582","192.168.100.12","192.168.100.10","TCP","66","9999  >  44034 [FIN, ACK] Seq=1 Ack=3642 Win=64128 Len=0 TSval=411813628 TSecr=4010906431"
"68","0.602335828","192.168.100.10","192.168.100.12","TCP","66","44034  >  9999 [ACK] Seq=3642 Ack=2 Win=64512 Len=0 TSval=4010906434 TSecr=411813628"
"69","0.605643043","192.168.100.12","192.168.100.10","TCP","74","51994  >  8888 [SYN] Seq=0 Win=64240 Len=0 MSS=1460 SACK_PERM TSval=411813632 TSecr=0 WS=128"
"70","0.605909062","192.168.100.10","192.168.100.12","TCP","74","8888  >  51994 [SYN, ACK] Seq=0 Ack=1 Win=65160 Len=0 MSS=1460 SACK_PERM TSval=4010906438 TSecr=411813632 WS=512"
"71","0.606153144","192.168.100.12","192.168.100.10","TCP","66","51994  >  8888 [ACK] Seq=1 Ack=1 Win=64256 Len=0 TSval=411813632 TSecr=4010906438"
"72","0.607559062","192.168.100.12","192.168.100.10","TCP","283","51994  >  8888 [PSH, ACK] Seq=1 Ack=1 Win=64256 Len=217 TSval=411813634 TSecr=4010906438"
"73","0.607559556","192.168.100.12","192.168.100.10","TCP","66","51994  >  8888 [FIN, ACK] Seq=218 Ack=1 Win=64256 Len=0 TSval=411813634 TSecr=4010906438"
"74","0.607603835","192.168.100.10","192.168.100.12","TCP","66","8888  >  51994 [ACK] Seq=1 Ack=218 Win=65024 Len=0 TSval=4010906439 TSecr=411813634"
"75","0.607734904","192.168.100.10","192.168.100.12","TCP","66","8888  >  51994 [FIN, ACK] Seq=1 Ack=219 Win=65024 Len=0 TSval=4010906439 TSecr=411813634"
"76","0.607852134","192.168.100.12","192.168.100.10","TCP","66","51994  >  8888 [ACK] Seq=219 Ack=2 Win=64256 Len=0 TSval=411813634 TSecr=4010906439"
"77","0.619899898","VMware_73:39:c1","Broadcast","ARP","60","Who has 192.168.100.12? Tell 192.168.100.11"
"78","0.620103777","VMware_48:a5:6d","VMware_73:39:c1","ARP","60","192.168.100.12 is at 00:0c:29:48:a5:6d"
"79","0.709199007","VMware_73:39:c1","Broadcast","ARP","60","Who has 192.168.100.13? Tell 192.168.100.11"
"80","0.709371255","VMware_50:3b:75","VMware_73:39:c1","ARP","60","192.168.100.13 is at 00:0c:29:50:3b:75"
"81","0.841155854","VMware_73:39:c1","Broadcast","ARP","60","Who has 192.168.100.12? Tell 192.168.100.11"
"82","0.843127714","VMware_48:a5:6d","VMware_73:39:c1","ARP","60","192.168.100.12 is at 00:0c:29:48:a5:6d"
"83","0.853306159","192.168.100.11","192.168.100.12","TCP","60","34159  >  3306 [SYN] Seq=0 Win=1024 Len=0 MSS=1460"
"84","0.853307473","192.168.100.11","192.168.100.12","TCP","60","34159  >  22 [SYN] Seq=0 Win=1024 Len=0 MSS=1460"
"85","0.853307505","192.168.100.11","192.168.100.12","TCP","60","34159  >  443 [SYN] Seq=0 Win=1024 Len=0 MSS=1460"
"86","0.853559546","192.168.100.12","192.168.100.11","TCP","60","3306  >  34159 [SYN, ACK] Seq=0 Ack=1 Win=64240 Len=0 MSS=1460"
"87","0.853559810","192.168.100.11","192.168.100.12","TCP","60","34159  >  80 [SYN] Seq=0 Win=1024 Len=0 MSS=1460"
"88","0.853758553","192.168.100.12","192.168.100.11","TCP","60","22  >  34159 [SYN, ACK] Seq=0 Ack=1 Win=64240 Len=0 MSS=1460"
"89","0.853758630","192.168.100.12","192.168.100.11","TCP","60","443  >  34159 [SYN, ACK] Seq=0 Ack=1 Win=64240 Len=0 MSS=1460"
"90","0.853758670","192.168.100.12","192.168.100.11","TCP","60","80  >  34159 [SYN, ACK] Seq=0 Ack=1 Win=64240 Len=0 MSS=1460"
"91","0.854326550","192.168.100.11","192.168.100.12","TCP","60","34159  >  3306 [RST] Seq=1 Win=0 Len=0"
"92","0.854326708","192.168.100.11","192.168.100.12","TCP","60","34159  >  22 [RST] Seq=1 Win=0 Len=0"
"93","0.854326742","192.168.100.11","192.168.100.12","TCP","60","34159  >  443 [RST] Seq=1 Win=0 Len=0"
"94","0.854326775","192.168.100.11","192.168.100.12","TCP","60","34159  >  80 [RST] Seq=1 Win=0 Len=0"
"95","0.854326808","192.168.100.11","192.168.100.12","TCP","60","34159  >  21 [SYN] Seq=0 Win=1024 Len=0 MSS=1460"
"96","0.854349470","192.168.100.11","192.168.100.12","TCP","60","34159  >  8080 [SYN] Seq=0 Win=1024 Len=0 MSS=1460"
"97","0.854395163","192.168.100.12","192.168.100.11","TCP","60","21  >  34159 [SYN, ACK] Seq=0 Ack=1 Win=64240 Len=0 MSS=1460"
"98","0.854472764","192.168.100.12","192.168.100.11","TCP","60","8080  >  34159 [SYN, ACK] Seq=0 Ack=1 Win=64240 Len=0 MSS=1460"
"99","0.854472932","192.168.100.11","192.168.100.12","TCP","60","34159  >  21 [RST] Seq=1 Win=0 Len=0"
"100","0.854472991","192.168.100.11","192.168.100.12","TCP","60","34159  >  8080 [RST] Seq=1 Win=0 Len=0"
"101","0.890364458","192.168.100.11","192.168.100.12","TCP","74","44792  >  9999 [SYN] Seq=0 Win=64240 Len=0 MSS=1460 SACK_PERM TSval=3502956318 TSecr=0 WS=128"
"102","0.890545931","192.168.100.12","192.168.100.11","TCP","74","9999  >  44792 [SYN, ACK] Seq=0 Ack=1 Win=65160 Len=0 MSS=1460 SACK_PERM TSval=2544227203 TSecr=3502956318 WS=128"
"103","0.890616241","192.168.100.11","192.168.100.12","TCP","66","44792  >  9999 [ACK] Seq=1 Ack=1 Win=64256 Len=0 TSval=3502956318 TSecr=2544227203"
"104","0.891340600","192.168.100.11","192.168.100.12","TCP","3688","44792  >  9999 [PSH, ACK] Seq=1 Ack=1 Win=64256 Len=3622 TSval=3502956318 TSecr=2544227203"
"105","0.891340790","192.168.100.11","192.168.100.12","TCP","66","44792  >  9999 [FIN, ACK] Seq=3623 Ack=1 Win=64256 Len=0 TSval=3502956319 TSecr=2544227203"
"106","0.891641770","192.168.100.12","192.168.100.11","TCP","66","9999  >  44792 [ACK] Seq=1 Ack=3623 Win=64128 Len=0 TSval=2544227204 TSecr=3502956318"
"107","0.893558834","192.168.100.12","192.168.100.11","TCP","66","9999  >  44792 [FIN, ACK] Seq=1 Ack=3624 Win=64128 Len=0 TSval=2544227205 TSecr=3502956319"
"108","0.893604122","192.168.100.11","192.168.100.12","TCP","66","44792  >  9999 [ACK] Seq=3624 Ack=2 Win=64256 Len=0 TSval=3502956321 TSecr=2544227205"
"109","0.897610149","192.168.100.12","192.168.100.10","TCP","74","51996  >  8888 [SYN] Seq=0 Win=64240 Len=0 MSS=1460 SACK_PERM TSval=411813924 TSecr=0 WS=128"
"110","0.897655160","192.168.100.10","192.168.100.12","TCP","74","8888  >  51996 [SYN, ACK] Seq=0 Ack=1 Win=65160 Len=0 MSS=1460 SACK_PERM TSval=4010906729 TSecr=411813924 WS=512"
"111","0.897803379","192.168.100.12","192.168.100.10","TCP","66","51996  >  8888 [ACK] Seq=1 Ack=1 Win=64256 Len=0 TSval=411813924 TSecr=4010906729"
"112","0.901732219","192.168.100.12","192.168.100.10","TCP","265","51996  >  8888 [PSH, ACK] Seq=1 Ack=1 Win=64256 Len=199 TSval=411813928 TSecr=4010906729"
"113","0.901732800","192.168.100.12","192.168.100.10","TCP","66","51996  >  8888 [FIN, ACK] Seq=200 Ack=1 Win=64256 Len=0 TSval=411813928 TSecr=4010906729"
"114","0.901801010","192.168.100.10","192.168.100.12","TCP","66","8888  >  51996 [ACK] Seq=1 Ack=200 Win=65024 Len=0 TSval=4010906733 TSecr=411813928"
"115","0.902047400","192.168.100.10","192.168.100.12","TCP","66","8888  >  51996 [FIN, ACK] Seq=1 Ack=201 Win=65024 Len=0 TSval=4010906734 TSecr=411813928"
"116","0.902268099","192.168.100.12","192.168.100.10","TCP","66","51996  >  8888 [ACK] Seq=201 Ack=2 Win=64256 Len=0 TSval=411813928 TSecr=4010906734"
"117","0.928132660","VMware_73:39:c1","Broadcast","ARP","60","Who has 192.168.100.13? Tell 192.168.100.11"
"118","0.928133855","VMware_50:3b:75","VMware_73:39:c1","ARP","60","192.168.100.13 is at 00:0c:29:50:3b:75"
"119","0.931615628","VMware_48:a5:6d","Broadcast","ARP","60","Who has 192.168.100.13? Tell 192.168.100.12"
"120","0.932130404","VMware_50:3b:75","VMware_48:a5:6d","ARP","60","192.168.100.13 is at 00:0c:29:50:3b:75"
"121","0.939071053","VMware_73:39:c1","Broadcast","ARP","60","Who has 192.168.100.13? Tell 192.168.100.11"
"122","0.939130698","VMware_50:3b:75","VMware_73:39:c1","ARP","60","192.168.100.13 is at 00:0c:29:50:3b:75"
"123","0.939268613","192.168.100.11","192.168.100.13","TCP","60","57880  >  443 [SYN] Seq=0 Win=1024 Len=0 MSS=1460"
"124","0.939268724","192.168.100.11","192.168.100.13","TCP","60","57880  >  8080 [SYN] Seq=0 Win=1024 Len=0 MSS=1460"
"125","0.939268810","192.168.100.11","192.168.100.13","TCP","60","57880  >  22 [SYN] Seq=0 Win=1024 Len=0 MSS=1460"
"126","0.939268844","192.168.100.11","192.168.100.13","TCP","60","57880  >  3306 [SYN] Seq=0 Win=1024 Len=0 MSS=1460"
"127","0.939268878","192.168.100.11","192.168.100.13","TCP","60","57880  >  21 [SYN] Seq=0 Win=1024 Len=0 MSS=1460"
"128","0.939285376","192.168.100.11","192.168.100.13","TCP","60","57880  >  80 [SYN] Seq=0 Win=1024 Len=0 MSS=1460"
"129","0.939854452","192.168.100.13","192.168.100.11","TCP","60","443  >  57880 [SYN, ACK] Seq=0 Ack=1 Win=64240 Len=0 MSS=1460"
"130","0.939854634","192.168.100.13","192.168.100.11","TCP","60","8080  >  57880 [SYN, ACK] Seq=0 Ack=1 Win=64240 Len=0 MSS=1460"
"131","0.939854670","192.168.100.13","192.168.100.11","TCP","60","22  >  57880 [SYN, ACK] Seq=0 Ack=1 Win=64240 Len=0 MSS=1460"
"132","0.939874990","192.168.100.11","192.168.100.13","TCP","60","57880  >  443 [RST] Seq=1 Win=0 Len=0"
"133","0.939923657","192.168.100.13","192.168.100.11","TCP","60","3306  >  57880 [SYN, ACK] Seq=0 Ack=1 Win=64240 Len=0 MSS=1460"
"134","0.939923754","192.168.100.11","192.168.100.13","TCP","60","57880  >  8080 [RST] Seq=1 Win=0 Len=0"
"135","0.939923794","192.168.100.13","192.168.100.11","TCP","60","21  >  57880 [SYN, ACK] Seq=0 Ack=1 Win=64240 Len=0 MSS=1460"
"136","0.939954263","192.168.100.11","192.168.100.13","TCP","60","57880  >  22 [RST] Seq=1 Win=0 Len=0"
"137","0.939954307","192.168.100.13","192.168.100.11","TCP","60","80  >  57880 [SYN, ACK] Seq=0 Ack=1 Win=64240 Len=0 MSS=1460"
"138","0.940602339","192.168.100.11","192.168.100.13","TCP","60","57880  >  3306 [RST] Seq=1 Win=0 Len=0"
"139","0.940602550","192.168.100.11","192.168.100.13","TCP","60","57880  >  21 [RST] Seq=1 Win=0 Len=0"
"140","0.940602611","192.168.100.11","192.168.100.13","TCP","60","57880  >  80 [RST] Seq=1 Win=0 Len=0"
"141","0.970945618","192.168.100.11","192.168.100.13","TCP","74","48742  >  9999 [SYN] Seq=0 Win=64240 Len=0 MSS=1460 SACK_PERM TSval=3827297857 TSecr=0 WS=128"
"142","0.971125049","192.168.100.13","192.168.100.11","TCP","74","9999  >  48742 [SYN, ACK] Seq=0 Ack=1 Win=65160 Len=0 MSS=1460 SACK_PERM TSval=1612335595 TSecr=3827297857 WS=128"
"143","0.971514993","192.168.100.11","192.168.100.13","TCP","66","48742  >  9999 [ACK] Seq=1 Ack=1 Win=64256 Len=0 TSval=3827297858 TSecr=1612335595"
"144","0.971515273","192.168.100.11","192.168.100.13","TCP","3706","48742  >  9999 [PSH, ACK] Seq=1 Ack=1 Win=64256 Len=3640 TSval=3827297858 TSecr=1612335595"
"145","0.971515309","192.168.100.11","192.168.100.13","TCP","66","48742  >  9999 [FIN, ACK] Seq=3641 Ack=1 Win=64256 Len=0 TSval=3827297858 TSecr=1612335595"
"146","0.971852170","192.168.100.13","192.168.100.11","TCP","66","9999  >  48742 [ACK] Seq=1 Ack=3641 Win=64128 Len=0 TSval=1612335595 TSecr=3827297858"
"147","0.972415596","192.168.100.13","192.168.100.11","TCP","66","9999  >  48742 [FIN, ACK] Seq=1 Ack=3642 Win=64128 Len=0 TSval=1612335596 TSecr=3827297858"
"148","0.972503913","192.168.100.11","192.168.100.13","TCP","66","48742  >  9999 [ACK] Seq=3642 Ack=2 Win=64256 Len=0 TSval=3827297859 TSecr=1612335596"
"149","0.976887256","192.168.100.13","192.168.100.10","TCP","74","46674  >  8888 [SYN] Seq=0 Win=64240 Len=0 MSS=1460 SACK_PERM TSval=1724918153 TSecr=0 WS=128"
"150","0.976932830","192.168.100.10","192.168.100.13","TCP","74","8888  >  46674 [SYN, ACK] Seq=0 Ack=1 Win=65160 Len=0 MSS=1460 SACK_PERM TSval=2451354264 TSecr=1724918153 WS=512"
"151","0.977230919","192.168.100.13","192.168.100.10","TCP","66","46674  >  8888 [ACK] Seq=1 Ack=1 Win=64256 Len=0 TSval=1724918154 TSecr=2451354264"
"152","0.977647046","192.168.100.13","192.168.100.10","TCP","283","46674  >  8888 [PSH, ACK] Seq=1 Ack=1 Win=64256 Len=217 TSval=1724918154 TSecr=2451354264"
"153","0.977647211","192.168.100.13","192.168.100.10","TCP","66","46674  >  8888 [FIN, ACK] Seq=218 Ack=1 Win=64256 Len=0 TSval=1724918154 TSecr=2451354264"
"154","0.977678559","192.168.100.10","192.168.100.13","TCP","66","8888  >  46674 [ACK] Seq=1 Ack=218 Win=65024 Len=0 TSval=2451354264 TSecr=1724918154"
"155","0.977785372","192.168.100.10","192.168.100.13","TCP","66","8888  >  46674 [FIN, ACK] Seq=1 Ack=219 Win=65024 Len=0 TSval=2451354264 TSecr=1724918154"
"156","0.977986467","192.168.100.13","192.168.100.10","TCP","66","46674  >  8888 [ACK] Seq=219 Ack=2 Win=64256 Len=0 TSval=1724918155 TSecr=2451354264"
"157","1.056547656","VMware_48:a5:6d","Broadcast","ARP","60","Who has 192.168.100.14? Tell 192.168.100.12"
"158","1.056857950","VMware_ed:58:af","VMware_48:a5:6d","ARP","60","192.168.100.14 is at 00:0c:29:ed:58:af"
"159","1.145481042","VMware_48:a5:6d","Broadcast","ARP","60","Who has 192.168.100.13? Tell 192.168.100.12"
"160","1.145646624","VMware_50:3b:75","VMware_48:a5:6d","ARP","60","192.168.100.13 is at 00:0c:29:50:3b:75"
"161","1.155610421","VMware_48:a5:6d","Broadcast","ARP","60","Who has 192.168.100.13? Tell 192.168.100.12"
"162","1.155771809","VMware_50:3b:75","VMware_48:a5:6d","ARP","60","192.168.100.13 is at 00:0c:29:50:3b:75"
"163","1.155872705","192.168.100.12","192.168.100.13","TCP","60","41301  >  443 [SYN] Seq=0 Win=1024 Len=0 MSS=1460"
"164","1.155872767","192.168.100.12","192.168.100.13","TCP","60","41301  >  8080 [SYN] Seq=0 Win=1024 Len=0 MSS=1460"
"165","1.155872798","192.168.100.12","192.168.100.13","TCP","60","41301  >  22 [SYN] Seq=0 Win=1024 Len=0 MSS=1460"
"166","1.155896305","192.168.100.12","192.168.100.13","TCP","60","41301  >  21 [SYN] Seq=0 Win=1024 Len=0 MSS=1460"
"167","1.155896332","192.168.100.12","192.168.100.13","TCP","60","41301  >  80 [SYN] Seq=0 Win=1024 Len=0 MSS=1460"
"168","1.155938366","192.168.100.12","192.168.100.13","TCP","60","41301  >  3306 [SYN] Seq=0 Win=1024 Len=0 MSS=1460"
"169","1.156587032","192.168.100.13","192.168.100.12","TCP","60","443  >  41301 [SYN, ACK] Seq=0 Ack=1 Win=64240 Len=0 MSS=1460"
"170","1.156587381","192.168.100.13","192.168.100.12","TCP","60","8080  >  41301 [SYN, ACK] Seq=0 Ack=1 Win=64240 Len=0 MSS=1460"
"171","1.156587418","192.168.100.13","192.168.100.12","TCP","60","22  >  41301 [SYN, ACK] Seq=0 Ack=1 Win=64240 Len=0 MSS=1460"
"172","1.156587456","192.168.100.13","192.168.100.12","TCP","60","21  >  41301 [SYN, ACK] Seq=0 Ack=1 Win=64240 Len=0 MSS=1460"
"173","1.156587492","192.168.100.13","192.168.100.12","TCP","60","80  >  41301 [SYN, ACK] Seq=0 Ack=1 Win=64240 Len=0 MSS=1460"
"174","1.156587526","192.168.100.13","192.168.100.12","TCP","60","3306  >  41301 [SYN, ACK] Seq=0 Ack=1 Win=64240 Len=0 MSS=1460"
"175","1.156874271","192.168.100.12","192.168.100.13","TCP","60","41301  >  443 [RST] Seq=1 Win=0 Len=0"
"176","1.156874335","192.168.100.12","192.168.100.13","TCP","60","41301  >  8080 [RST] Seq=1 Win=0 Len=0"
"177","1.156893211","192.168.100.12","192.168.100.13","TCP","60","41301  >  22 [RST] Seq=1 Win=0 Len=0"
"178","1.156920262","192.168.100.12","192.168.100.13","TCP","60","41301  >  21 [RST] Seq=1 Win=0 Len=0"
"179","1.156920293","192.168.100.12","192.168.100.13","TCP","60","41301  >  80 [RST] Seq=1 Win=0 Len=0"
"180","1.157006260","192.168.100.12","192.168.100.13","TCP","60","41301  >  3306 [RST] Seq=1 Win=0 Len=0"
"181","1.179312067","192.168.100.12","192.168.100.13","TCP","74","42982  >  9999 [SYN] Seq=0 Win=64240 Len=0 MSS=1460 SACK_PERM TSval=637528536 TSecr=0 WS=128"
"182","1.179668788","192.168.100.13","192.168.100.12","TCP","74","9999  >  42982 [SYN, ACK] Seq=0 Ack=1 Win=65160 Len=0 MSS=1460 SACK_PERM TSval=1802649653 TSecr=637528536 WS=128"
"183","1.179789081","192.168.100.12","192.168.100.13","TCP","66","42982  >  9999 [ACK] Seq=1 Ack=1 Win=64256 Len=0 TSval=637528537 TSecr=1802649653"
"184","1.180201552","192.168.100.12","192.168.100.13","TCP","3706","42982  >  9999 [PSH, ACK] Seq=1 Ack=1 Win=64256 Len=3640 TSval=637528537 TSecr=1802649653"
"185","1.180201704","192.168.100.12","192.168.100.13","TCP","66","42982  >  9999 [FIN, ACK] Seq=3641 Ack=1 Win=64256 Len=0 TSval=637528537 TSecr=1802649653"
"186","1.180201736","192.168.100.13","192.168.100.12","TCP","66","9999  >  42982 [ACK] Seq=1 Ack=3641 Win=64128 Len=0 TSval=1802649654 TSecr=637528537"
"187","1.183559053","192.168.100.13","192.168.100.12","TCP","66","9999  >  42982 [FIN, ACK] Seq=1 Ack=3642 Win=64128 Len=0 TSval=1802649657 TSecr=637528537"
"188","1.183600187","192.168.100.12","192.168.100.13","TCP","66","42982  >  9999 [ACK] Seq=3642 Ack=2 Win=64256 Len=0 TSval=637528541 TSecr=1802649657"
"189","1.192414697","192.168.100.13","192.168.100.10","TCP","74","46686  >  8888 [SYN] Seq=0 Win=64240 Len=0 MSS=1460 SACK_PERM TSval=1724918369 TSecr=0 WS=128"
"190","1.192850487","192.168.100.10","192.168.100.13","TCP","74","8888  >  46686 [SYN, ACK] Seq=0 Ack=1 Win=65160 Len=0 MSS=1460 SACK_PERM TSval=2451354480 TSecr=1724918369 WS=512"
"191","1.193067227","192.168.100.13","192.168.100.10","TCP","66","46686  >  8888 [ACK] Seq=1 Ack=1 Win=64256 Len=0 TSval=1724918370 TSecr=2451354480"
"192","1.193411122","192.168.100.13","192.168.100.10","TCP","283","46686  >  8888 [PSH, ACK] Seq=1 Ack=1 Win=64256 Len=217 TSval=1724918370 TSecr=2451354480"
"193","1.193411305","192.168.100.13","192.168.100.10","TCP","66","46686  >  8888 [FIN, ACK] Seq=218 Ack=1 Win=64256 Len=0 TSval=1724918370 TSecr=2451354480"
"194","1.193426217","192.168.100.10","192.168.100.13","TCP","66","8888  >  46686 [ACK] Seq=1 Ack=218 Win=65024 Len=0 TSval=2451354480 TSecr=1724918370"
"195","1.193505124","192.168.100.10","192.168.100.13","TCP","66","8888  >  46686 [FIN, ACK] Seq=1 Ack=219 Win=65024 Len=0 TSval=2451354480 TSecr=1724918370"
"196","1.193586732","192.168.100.13","192.168.100.10","TCP","66","46686  >  8888 [ACK] Seq=219 Ack=2 Win=64256 Len=0 TSval=1724918370 TSecr=2451354480"
"197","1.231398895","VMware_48:a5:6d","Broadcast","ARP","60","Who has 192.168.100.14? Tell 192.168.100.12"
"198","1.231593476","VMware_ed:58:af","VMware_48:a5:6d","ARP","60","192.168.100.14 is at 00:0c:29:ed:58:af"
"199","1.243185789","192.168.100.12","192.168.100.14","TCP","60","51721  >  3306 [SYN] Seq=0 Win=1024 Len=0 MSS=1460"
"200","1.243186619","192.168.100.12","192.168.100.14","TCP","60","51721  >  443 [SYN] Seq=0 Win=1024 Len=0 MSS=1460"
"201","1.243186786","192.168.100.12","192.168.100.14","TCP","60","51721  >  22 [SYN] Seq=0 Win=1024 Len=0 MSS=1460"
"202","1.243186825","192.168.100.12","192.168.100.14","TCP","60","51721  >  21 [SYN] Seq=0 Win=1024 Len=0 MSS=1460"
"203","1.243274512","192.168.100.12","192.168.100.14","TCP","60","51721  >  80 [SYN] Seq=0 Win=1024 Len=0 MSS=1460"
"204","1.243274698","192.168.100.12","192.168.100.14","TCP","60","51721  >  8080 [SYN] Seq=0 Win=1024 Len=0 MSS=1460"
"205","1.243274751","192.168.100.14","192.168.100.12","TCP","60","3306  >  51721 [SYN, ACK] Seq=0 Ack=1 Win=64240 Len=0 MSS=1460"
"206","1.243555677","192.168.100.12","192.168.100.14","TCP","60","51721  >  3306 [RST] Seq=1 Win=0 Len=0"
"207","1.243884016","192.168.100.14","192.168.100.12","TCP","60","443  >  51721 [SYN, ACK] Seq=0 Ack=1 Win=64240 Len=0 MSS=1460"
"208","1.243937261","192.168.100.14","192.168.100.12","TCP","60","22  >  51721 [SYN, ACK] Seq=0 Ack=1 Win=64240 Len=0 MSS=1460"
"209","1.243937328","192.168.100.14","192.168.100.12","TCP","60","21  >  51721 [SYN, ACK] Seq=0 Ack=1 Win=64240 Len=0 MSS=1460"
"210","1.243937362","192.168.100.12","192.168.100.14","TCP","60","51721  >  443 [RST] Seq=1 Win=0 Len=0"
"211","1.243965917","192.168.100.14","192.168.100.12","TCP","60","80  >  51721 [SYN, ACK] Seq=0 Ack=1 Win=64240 Len=0 MSS=1460"
"212","1.243980521","192.168.100.12","192.168.100.14","TCP","60","51721  >  22 [RST] Seq=1 Win=0 Len=0"
"213","1.243980566","192.168.100.12","192.168.100.14","TCP","60","51721  >  21 [RST] Seq=1 Win=0 Len=0"
"214","1.244058145","192.168.100.12","192.168.100.14","TCP","60","51721  >  80 [RST] Seq=1 Win=0 Len=0"
"215","1.244684572","192.168.100.14","192.168.100.12","TCP","60","8080  >  51721 [SYN, ACK] Seq=0 Ack=1 Win=64240 Len=0 MSS=1460"
"216","1.244725945","192.168.100.12","192.168.100.14","TCP","60","51721  >  8080 [RST] Seq=1 Win=0 Len=0"
"217","1.264518578","192.168.100.12","192.168.100.14","TCP","74","59142  >  9999 [SYN] Seq=0 Win=64240 Len=0 MSS=1460 SACK_PERM TSval=3839050515 TSecr=0 WS=128"
"218","1.264694904","192.168.100.14","192.168.100.12","TCP","74","9999  >  59142 [SYN, ACK] Seq=0 Ack=1 Win=65160 Len=0 MSS=1460 SACK_PERM TSval=1645753887 TSecr=3839050515 WS=128"
"219","1.264958671","192.168.100.12","192.168.100.14","TCP","66","59142  >  9999 [ACK] Seq=1 Ack=1 Win=64256 Len=0 TSval=3839050515 TSecr=1645753887"
"220","1.264958841","192.168.100.12","192.168.100.14","TCP","3724","59142  >  9999 [PSH, ACK] Seq=1 Ack=1 Win=64256 Len=3658 TSval=3839050515 TSecr=1645753887"
"221","1.264986311","192.168.100.12","192.168.100.14","TCP","66","59142  >  9999 [FIN, ACK] Seq=3659 Ack=1 Win=64256 Len=0 TSval=3839050515 TSecr=1645753887"
"222","1.265095392","192.168.100.14","192.168.100.12","TCP","66","9999  >  59142 [ACK] Seq=1 Ack=3659 Win=64128 Len=0 TSval=1645753887 TSecr=3839050515"
"223","1.329512073","192.168.100.14","192.168.100.12","TCP","66","9999  >  59142 [ACK] Seq=1 Ack=3660 Win=64128 Len=0 TSval=1645753951 TSecr=3839050515"
"224","1.329513022","192.168.100.14","192.168.100.12","TCP","66","9999  >  59142 [FIN, ACK] Seq=1 Ack=3660 Win=64128 Len=0 TSval=1645753951 TSecr=3839050515"
"225","1.329553671","192.168.100.12","192.168.100.14","TCP","66","59142  >  9999 [ACK] Seq=3660 Ack=2 Win=64256 Len=0 TSval=3839050580 TSecr=1645753951"
"226","1.332460476","192.168.100.14","192.168.100.10","TCP","74","49726  >  8888 [SYN] Seq=0 Win=64240 Len=0 MSS=1460 SACK_PERM TSval=3424521133 TSecr=0 WS=128"
"227","1.332525194","192.168.100.10","192.168.100.14","TCP","74","8888  >  49726 [SYN, ACK] Seq=0 Ack=1 Win=65160 Len=0 MSS=1460 SACK_PERM TSval=1739378336 TSecr=3424521133 WS=512"
"228","1.332795682","192.168.100.14","192.168.100.10","TCP","66","49726  >  8888 [ACK] Seq=1 Ack=1 Win=64256 Len=0 TSval=3424521134 TSecr=1739378336"
"229","1.334077357","192.168.100.14","192.168.100.10","TCP","301","49726  >  8888 [PSH, ACK] Seq=1 Ack=1 Win=64256 Len=235 TSval=3424521134 TSecr=1739378336"
"230","1.334125282","192.168.100.10","192.168.100.14","TCP","66","8888  >  49726 [ACK] Seq=1 Ack=236 Win=65024 Len=0 TSval=1739378338 TSecr=3424521134"
"231","1.334350572","192.168.100.14","192.168.100.10","TCP","66","49726  >  8888 [FIN, ACK] Seq=236 Ack=1 Win=64256 Len=0 TSval=3424521135 TSecr=1739378336"
"232","1.334518337","192.168.100.10","192.168.100.14","TCP","66","8888  >  49726 [FIN, ACK] Seq=1 Ack=237 Win=65024 Len=0 TSval=1739378338 TSecr=3424521135"
"233","1.335091407","192.168.100.14","192.168.100.10","TCP","66","49726  >  8888 [ACK] Seq=237 Ack=2 Win=64256 Len=0 TSval=3424521136 TSecr=1739378338"
"234","1.424460503","VMware_50:3b:75","Broadcast","ARP","60","Who has 192.168.100.14? Tell 192.168.100.13"
"235","1.424661829","VMware_ed:58:af","VMware_50:3b:75","ARP","60","192.168.100.14 is at 00:0c:29:ed:58:af"
"236","1.460711877","VMware_50:3b:75","Broadcast","ARP","60","Who has 192.168.100.15? Tell 192.168.100.13"
"237","1.460774403","VMware_59:33:4b","VMware_50:3b:75","ARP","60","192.168.100.15 is at 00:0c:29:59:33:4b"
"238","1.516068910","VMware_50:3b:75","Broadcast","ARP","60","Who has 192.168.100.14? Tell 192.168.100.13"
"239","1.516309300","VMware_ed:58:af","VMware_50:3b:75","ARP","60","192.168.100.14 is at 00:0c:29:ed:58:af"
"240","1.526046719","VMware_ed:58:af","Broadcast","ARP","60","Who has 192.168.100.15? Tell 192.168.100.14"
"241","1.526272226","VMware_59:33:4b","VMware_ed:58:af","ARP","60","192.168.100.15 is at 00:0c:29:59:33:4b"
"242","1.527697767","192.168.100.13","192.168.100.14","TCP","60","48957  >  3306 [SYN] Seq=0 Win=1024 Len=0 MSS=1460"
"243","1.527698050","192.168.100.13","192.168.100.14","TCP","60","48957  >  22 [SYN] Seq=0 Win=1024 Len=0 MSS=1460"
"244","1.527698079","192.168.100.13","192.168.100.14","TCP","60","48957  >  80 [SYN] Seq=0 Win=1024 Len=0 MSS=1460"
"245","1.527698110","192.168.100.13","192.168.100.14","TCP","60","48957  >  21 [SYN] Seq=0 Win=1024 Len=0 MSS=1460"
"246","1.527698139","192.168.100.13","192.168.100.14","TCP","60","48957  >  8080 [SYN] Seq=0 Win=1024 Len=0 MSS=1460"
"247","1.527698168","192.168.100.13","192.168.100.14","TCP","60","48957  >  443 [SYN] Seq=0 Win=1024 Len=0 MSS=1460"
"248","1.527865265","192.168.100.14","192.168.100.13","TCP","60","3306  >  48957 [SYN, ACK] Seq=0 Ack=1 Win=64240 Len=0 MSS=1460"
"249","1.527865509","192.168.100.14","192.168.100.13","TCP","60","22  >  48957 [SYN, ACK] Seq=0 Ack=1 Win=64240 Len=0 MSS=1460"
"250","1.527865542","192.168.100.14","192.168.100.13","TCP","60","80  >  48957 [SYN, ACK] Seq=0 Ack=1 Win=64240 Len=0 MSS=1460"
"251","1.528115132","192.168.100.14","192.168.100.13","TCP","60","21  >  48957 [SYN, ACK] Seq=0 Ack=1 Win=64240 Len=0 MSS=1460"
"252","1.528115294","192.168.100.14","192.168.100.13","TCP","60","8080  >  48957 [SYN, ACK] Seq=0 Ack=1 Win=64240 Len=0 MSS=1460"
"253","1.528115327","192.168.100.14","192.168.100.13","TCP","60","443  >  48957 [SYN, ACK] Seq=0 Ack=1 Win=64240 Len=0 MSS=1460"
"254","1.528115361","192.168.100.13","192.168.100.14","TCP","60","48957  >  3306 [RST] Seq=1 Win=0 Len=0"
"255","1.528115393","192.168.100.13","192.168.100.14","TCP","60","48957  >  22 [RST] Seq=1 Win=0 Len=0"
"256","1.528115426","192.168.100.13","192.168.100.14","TCP","60","48957  >  80 [RST] Seq=1 Win=0 Len=0"
"257","1.528115460","192.168.100.13","192.168.100.14","TCP","60","48957  >  21 [RST] Seq=1 Win=0 Len=0"
"258","1.528115493","192.168.100.13","192.168.100.14","TCP","60","48957  >  8080 [RST] Seq=1 Win=0 Len=0"
"259","1.528123552","192.168.100.13","192.168.100.14","TCP","60","48957  >  443 [RST] Seq=1 Win=0 Len=0"
"260","1.556056458","192.168.100.13","192.168.100.14","TCP","74","39932  >  9999 [SYN] Seq=0 Win=64240 Len=0 MSS=1460 SACK_PERM TSval=390523396 TSecr=0 WS=128"
"261","1.556247711","192.168.100.14","192.168.100.13","TCP","74","9999  >  39932 [SYN, ACK] Seq=0 Ack=1 Win=65160 Len=0 MSS=1460 SACK_PERM TSval=3446673544 TSecr=390523396 WS=128"
"262","1.556389392","192.168.100.13","192.168.100.14","TCP","66","39932  >  9999 [ACK] Seq=1 Ack=1 Win=64256 Len=0 TSval=390523396 TSecr=3446673544"
"263","1.557173252","192.168.100.13","192.168.100.14","TCP","3706","39932  >  9999 [PSH, ACK] Seq=1 Ack=1 Win=64256 Len=3640 TSval=390523396 TSecr=3446673544"
"264","1.557301820","192.168.100.14","192.168.100.13","TCP","66","9999  >  39932 [ACK] Seq=1 Ack=3641 Win=64128 Len=0 TSval=3446673545 TSecr=390523396"
"265","1.557463746","192.168.100.13","192.168.100.14","TCP","66","39932  >  9999 [FIN, ACK] Seq=3641 Ack=1 Win=64256 Len=0 TSval=390523397 TSecr=3446673545"
"266","1.560212917","192.168.100.14","192.168.100.13","TCP","66","9999  >  39932 [FIN, ACK] Seq=1 Ack=3642 Win=64128 Len=0 TSval=3446673548 TSecr=390523397"
"267","1.560296512","192.168.100.13","192.168.100.14","TCP","66","39932  >  9999 [ACK] Seq=3642 Ack=2 Win=64256 Len=0 TSval=390523400 TSecr=3446673548"
"268","1.567778445","192.168.100.14","192.168.100.10","TCP","74","49728  >  8888 [SYN] Seq=0 Win=64240 Len=0 MSS=1460 SACK_PERM TSval=3424521368 TSecr=0 WS=128"
"269","1.567865162","192.168.100.10","192.168.100.14","TCP","74","8888  >  49728 [SYN, ACK] Seq=0 Ack=1 Win=65160 Len=0 MSS=1460 SACK_PERM TSval=1739378572 TSecr=3424521368 WS=512"
"270","1.568188483","192.168.100.14","192.168.100.10","TCP","66","49728  >  8888 [ACK] Seq=1 Ack=1 Win=64256 Len=0 TSval=3424521369 TSecr=1739378572"
"271","1.575837740","192.168.100.14","192.168.100.10","TCP","283","49728  >  8888 [PSH, ACK] Seq=1 Ack=1 Win=64256 Len=217 TSval=3424521376 TSecr=1739378572"
"272","1.575838262","192.168.100.14","192.168.100.10","TCP","66","49728  >  8888 [FIN, ACK] Seq=218 Ack=1 Win=64256 Len=0 TSval=3424521377 TSecr=1739378572"
"273","1.575913841","192.168.100.10","192.168.100.14","TCP","66","8888  >  49728 [ACK] Seq=1 Ack=218 Win=65024 Len=0 TSval=1739378580 TSecr=3424521376"
"274","1.576087585","192.168.100.10","192.168.100.14","TCP","66","8888  >  49728 [FIN, ACK] Seq=1 Ack=219 Win=65024 Len=0 TSval=1739378580 TSecr=3424521377"
"275","1.576286883","192.168.100.14","192.168.100.10","TCP","66","49728  >  8888 [ACK] Seq=219 Ack=2 Win=64256 Len=0 TSval=3424521377 TSecr=1739378580"
"276","1.599137173","VMware_50:3b:75","Broadcast","ARP","60","Who has 192.168.100.15? Tell 192.168.100.13"
"277","1.599315121","VMware_59:33:4b","VMware_50:3b:75","ARP","60","192.168.100.15 is at 00:0c:29:59:33:4b"
"278","1.610457660","192.168.100.13","192.168.100.15","TCP","60","41157  >  22 [SYN] Seq=0 Win=1024 Len=0 MSS=1460"
"279","1.610458177","192.168.100.13","192.168.100.15","TCP","60","41157  >  8080 [SYN] Seq=0 Win=1024 Len=0 MSS=1460"
"280","1.610458209","192.168.100.13","192.168.100.15","TCP","60","41157  >  80 [SYN] Seq=0 Win=1024 Len=0 MSS=1460"
"281","1.610458245","192.168.100.13","192.168.100.15","TCP","60","41157  >  443 [SYN] Seq=0 Win=1024 Len=0 MSS=1460"
"282","1.610458279","192.168.100.13","192.168.100.15","TCP","60","41157  >  3306 [SYN] Seq=0 Win=1024 Len=0 MSS=1460"
"283","1.610458313","192.168.100.13","192.168.100.15","TCP","60","41157  >  21 [SYN] Seq=0 Win=1024 Len=0 MSS=1460"
"284","1.611250175","192.168.100.15","192.168.100.13","TCP","60","22  >  41157 [SYN, ACK] Seq=0 Ack=1 Win=64240 Len=0 MSS=1460"
"285","1.611250577","192.168.100.15","192.168.100.13","TCP","60","8080  >  41157 [SYN, ACK] Seq=0 Ack=1 Win=64240 Len=0 MSS=1460"
"286","1.611250618","192.168.100.15","192.168.100.13","TCP","60","80  >  41157 [SYN, ACK] Seq=0 Ack=1 Win=64240 Len=0 MSS=1460"
"287","1.611250655","192.168.100.15","192.168.100.13","TCP","60","443  >  41157 [SYN, ACK] Seq=0 Ack=1 Win=64240 Len=0 MSS=1460"
"288","1.611323696","192.168.100.15","192.168.100.13","TCP","60","3306  >  41157 [SYN, ACK] Seq=0 Ack=1 Win=64240 Len=0 MSS=1460"
"289","1.611323751","192.168.100.15","192.168.100.13","TCP","60","21  >  41157 [SYN, ACK] Seq=0 Ack=1 Win=64240 Len=0 MSS=1460"
"290","1.611323787","192.168.100.13","192.168.100.15","TCP","60","41157  >  22 [RST] Seq=1 Win=0 Len=0"
"291","1.611340707","192.168.100.13","192.168.100.15","TCP","60","41157  >  8080 [RST] Seq=1 Win=0 Len=0"
"292","1.611340764","192.168.100.13","192.168.100.15","TCP","60","41157  >  80 [RST] Seq=1 Win=0 Len=0"
"293","1.611355903","192.168.100.13","192.168.100.15","TCP","60","41157  >  443 [RST] Seq=1 Win=0 Len=0"
"294","1.611406342","192.168.100.13","192.168.100.15","TCP","60","41157  >  3306 [RST] Seq=1 Win=0 Len=0"
"295","1.611406395","192.168.100.13","192.168.100.15","TCP","60","41157  >  21 [RST] Seq=1 Win=0 Len=0"
"296","1.641184458","192.168.100.13","192.168.100.15","TCP","74","47946  >  9999 [SYN] Seq=0 Win=64240 Len=0 MSS=1460 SACK_PERM TSval=585820982 TSecr=0 WS=128"
"297","1.641774531","192.168.100.15","192.168.100.13","TCP","74","9999  >  47946 [SYN, ACK] Seq=0 Ack=1 Win=65160 Len=0 MSS=1460 SACK_PERM TSval=1819944258 TSecr=585820982 WS=128"
"298","1.641831726","192.168.100.13","192.168.100.15","TCP","66","47946  >  9999 [ACK] Seq=1 Ack=1 Win=64256 Len=0 TSval=585820983 TSecr=1819944258"
"299","1.642045529","192.168.100.13","192.168.100.15","TCP","3724","47946  >  9999 [PSH, ACK] Seq=1 Ack=1 Win=64256 Len=3658 TSval=585820983 TSecr=1819944258"
"300","1.642045769","192.168.100.13","192.168.100.15","TCP","66","47946  >  9999 [FIN, ACK] Seq=3659 Ack=1 Win=64256 Len=0 TSval=585820983 TSecr=1819944258"
"301","1.642226556","192.168.100.15","192.168.100.13","TCP","66","9999  >  47946 [ACK] Seq=1 Ack=3659 Win=64128 Len=0 TSval=1819944259 TSecr=585820983"
"302","1.642789717","192.168.100.15","192.168.100.13","TCP","66","9999  >  47946 [FIN, ACK] Seq=1 Ack=3660 Win=64128 Len=0 TSval=1819944259 TSecr=585820983"
"303","1.643005985","192.168.100.13","192.168.100.15","TCP","66","47946  >  9999 [ACK] Seq=3660 Ack=2 Win=64256 Len=0 TSval=585820984 TSecr=1819944259"
"304","1.651774948","192.168.100.15","192.168.100.10","TCP","74","60464  >  8888 [SYN] Seq=0 Win=64240 Len=0 MSS=1460 SACK_PERM TSval=3104720740 TSecr=0 WS=128"
"305","1.651861665","192.168.100.10","192.168.100.15","TCP","74","8888  >  60464 [SYN, ACK] Seq=0 Ack=1 Win=65160 Len=0 MSS=1460 SACK_PERM TSval=156824301 TSecr=3104720740 WS=512"
"306","1.652129279","192.168.100.15","192.168.100.10","TCP","66","60464  >  8888 [ACK] Seq=1 Ack=1 Win=64256 Len=0 TSval=3104720740 TSecr=156824301"
"307","1.653360686","192.168.100.15","192.168.100.10","TCP","301","60464  >  8888 [PSH, ACK] Seq=1 Ack=1 Win=64256 Len=235 TSval=3104720741 TSecr=156824301"
"308","1.653426212","192.168.100.10","192.168.100.15","TCP","66","8888  >  60464 [ACK] Seq=1 Ack=236 Win=65024 Len=0 TSval=156824302 TSecr=3104720741"
"309","1.658396947","192.168.100.15","192.168.100.10","TCP","66","60464  >  8888 [FIN, ACK] Seq=236 Ack=1 Win=64256 Len=0 TSval=3104720747 TSecr=156824302"
"310","1.658544515","192.168.100.10","192.168.100.15","TCP","66","8888  >  60464 [FIN, ACK] Seq=1 Ack=237 Win=65024 Len=0 TSval=156824307 TSecr=3104720747"
"311","1.658948582","192.168.100.15","192.168.100.10","TCP","66","60464  >  8888 [ACK] Seq=237 Ack=2 Win=64256 Len=0 TSval=3104720747 TSecr=156824307"
"312","1.911963805","VMware_ed:58:af","Broadcast","ARP","60","Who has 192.168.100.15? Tell 192.168.100.14"
"313","1.912028445","VMware_59:33:4b","VMware_ed:58:af","ARP","60","192.168.100.15 is at 00:0c:29:59:33:4b"
"314","1.923056917","192.168.100.14","192.168.100.15","TCP","60","40549  >  8080 [SYN] Seq=0 Win=1024 Len=0 MSS=1460"
"315","1.923057546","192.168.100.14","192.168.100.15","TCP","60","40549  >  443 [SYN] Seq=0 Win=1024 Len=0 MSS=1460"
"316","1.923057592","192.168.100.14","192.168.100.15","TCP","60","40549  >  22 [SYN] Seq=0 Win=1024 Len=0 MSS=1460"
"317","1.923165998","192.168.100.15","192.168.100.14","TCP","60","8080  >  40549 [SYN, ACK] Seq=0 Ack=1 Win=64240 Len=0 MSS=1460"
"318","1.923166039","192.168.100.15","192.168.100.14","TCP","60","443  >  40549 [SYN, ACK] Seq=0 Ack=1 Win=64240 Len=0 MSS=1460"
"319","1.923287910","192.168.100.15","192.168.100.14","TCP","60","22  >  40549 [SYN, ACK] Seq=0 Ack=1 Win=64240 Len=0 MSS=1460"
"320","1.923683069","192.168.100.14","192.168.100.15","TCP","60","40549  >  8080 [RST] Seq=1 Win=0 Len=0"
"321","1.923683232","192.168.100.14","192.168.100.15","TCP","60","40549  >  443 [RST] Seq=1 Win=0 Len=0"
"322","1.923683293","192.168.100.14","192.168.100.15","TCP","60","40549  >  22 [RST] Seq=1 Win=0 Len=0"
"323","1.923763093","192.168.100.14","192.168.100.15","TCP","60","40549  >  80 [SYN] Seq=0 Win=1024 Len=0 MSS=1460"
"324","1.923802720","192.168.100.14","192.168.100.15","TCP","60","40549  >  21 [SYN] Seq=0 Win=1024 Len=0 MSS=1460"
"325","1.923847309","192.168.100.14","192.168.100.15","TCP","60","40549  >  3306 [SYN] Seq=0 Win=1024 Len=0 MSS=1460"
"326","1.923926931","192.168.100.15","192.168.100.14","TCP","60","80  >  40549 [SYN, ACK] Seq=0 Ack=1 Win=64240 Len=0 MSS=1460"
"327","1.923939371","192.168.100.15","192.168.100.14","TCP","60","21  >  40549 [SYN, ACK] Seq=0 Ack=1 Win=64240 Len=0 MSS=1460"
"328","1.923981404","192.168.100.15","192.168.100.14","TCP","60","3306  >  40549 [SYN, ACK] Seq=0 Ack=1 Win=64240 Len=0 MSS=1460"
"329","1.923992247","192.168.100.14","192.168.100.15","TCP","60","40549  >  80 [RST] Seq=1 Win=0 Len=0"
"330","1.924026091","192.168.100.14","192.168.100.15","TCP","60","40549  >  21 [RST] Seq=1 Win=0 Len=0"
"331","1.924078685","192.168.100.14","192.168.100.15","TCP","60","40549  >  3306 [RST] Seq=1 Win=0 Len=0"
"332","1.953532086","192.168.100.14","192.168.100.15","TCP","74","39058  >  9999 [SYN] Seq=0 Win=64240 Len=0 MSS=1460 SACK_PERM TSval=2399397650 TSecr=0 WS=128"
"333","1.953898811","192.168.100.15","192.168.100.14","TCP","74","9999  >  39058 [SYN, ACK] Seq=0 Ack=1 Win=65160 Len=0 MSS=1460 SACK_PERM TSval=2191541650 TSecr=2399397650 WS=128"
"334","1.953984678","192.168.100.14","192.168.100.15","TCP","66","39058  >  9999 [ACK] Seq=1 Ack=1 Win=64256 Len=0 TSval=2399397651 TSecr=2191541650"
"335","1.954905698","192.168.100.14","192.168.100.15","TCP","3724","39058  >  9999 [PSH, ACK] Seq=1 Ack=1 Win=64256 Len=3658 TSval=2399397651 TSecr=2191541650"
"336","1.954924359","192.168.100.15","192.168.100.14","TCP","66","9999  >  39058 [ACK] Seq=1 Ack=3659 Win=64128 Len=0 TSval=2191541651 TSecr=2399397651"
"337","1.955227052","192.168.100.14","192.168.100.15","TCP","66","39058  >  9999 [FIN, ACK] Seq=3659 Ack=1 Win=64256 Len=0 TSval=2399397652 TSecr=2191541651"
"338","1.955280078","192.168.100.15","192.168.100.14","TCP","66","9999  >  39058 [FIN, ACK] Seq=1 Ack=3660 Win=64128 Len=0 TSval=2191541652 TSecr=2399397652"
"339","1.955450147","192.168.100.14","192.168.100.15","TCP","66","39058  >  9999 [ACK] Seq=3660 Ack=2 Win=64256 Len=0 TSval=2399397652 TSecr=2191541652"
"340","1.958150888","192.168.100.15","192.168.100.10","TCP","74","60466  >  8888 [SYN] Seq=0 Win=64240 Len=0 MSS=1460 SACK_PERM TSval=3104721046 TSecr=0 WS=128"
"341","1.958197117","192.168.100.10","192.168.100.15","TCP","74","8888  >  60466 [SYN, ACK] Seq=0 Ack=1 Win=65160 Len=0 MSS=1460 SACK_PERM TSval=156824607 TSecr=3104721046 WS=512"
"342","1.958460562","192.168.100.15","192.168.100.10","TCP","66","60466  >  8888 [ACK] Seq=1 Ack=1 Win=64256 Len=0 TSval=3104721047 TSecr=156824607"
"343","1.958828284","192.168.100.15","192.168.100.10","TCP","301","60466  >  8888 [PSH, ACK] Seq=1 Ack=1 Win=64256 Len=235 TSval=3104721047 TSecr=156824607"
"344","1.958865148","192.168.100.10","192.168.100.15","TCP","66","8888  >  60466 [ACK] Seq=1 Ack=236 Win=65024 Len=0 TSval=156824608 TSecr=3104721047"
"345","1.959169330","192.168.100.15","192.168.100.10","TCP","66","60466  >  8888 [FIN, ACK] Seq=236 Ack=1 Win=64256 Len=0 TSval=3104721047 TSecr=156824607"
"346","1.959240323","192.168.100.10","192.168.100.15","TCP","66","8888  >  60466 [FIN, ACK] Seq=1 Ack=237 Win=65024 Len=0 TSval=156824608 TSecr=3104721047"
"347","1.960712980","192.168.100.15","192.168.100.10","TCP","66","60466  >  8888 [ACK] Seq=237 Ack=2 Win=64256 Len=0 TSval=3104721049 TSecr=156824608"
"348","5.457677932","VMware_73:39:c1","VMware_7a:70:0b","ARP","60","Who has 192.168.100.10? Tell 192.168.100.11"
"349","5.457698335","VMware_7a:70:0b","VMware_73:39:c1","ARP","42","192.168.100.10 is at 00:0c:29:7a:70:0b"
"350","5.942881105","VMware_48:a5:6d","VMware_73:39:c1","ARP","60","Who has 192.168.100.11? Tell 192.168.100.12"
"351","5.942881522","VMware_48:a5:6d","VMware_7a:70:0b","ARP","60","Who has 192.168.100.10? Tell 192.168.100.12"
"352","5.942904568","VMware_7a:70:0b","VMware_48:a5:6d","ARP","42","192.168.100.10 is at 00:0c:29:7a:70:0b"
"353","5.943084229","VMware_73:39:c1","VMware_48:a5:6d","ARP","60","192.168.100.11 is at 00:0c:29:73:39:c1"
"354","6.259340882","VMware_50:3b:75","VMware_48:a5:6d","ARP","60","Who has 192.168.100.12? Tell 192.168.100.13"
"355","6.259429162","VMware_50:3b:75","VMware_7a:70:0b","ARP","60","Who has 192.168.100.10? Tell 192.168.100.13"
"356","6.259429217","VMware_50:3b:75","VMware_73:39:c1","ARP","60","Who has 192.168.100.11? Tell 192.168.100.13"
"357","6.259449503","VMware_7a:70:0b","VMware_50:3b:75","ARP","42","192.168.100.10 is at 00:0c:29:7a:70:0b"
"358","6.259688604","VMware_48:a5:6d","VMware_50:3b:75","ARP","60","192.168.100.12 is at 00:0c:29:48:a5:6d"
"359","6.259815616","VMware_73:39:c1","VMware_50:3b:75","ARP","60","192.168.100.11 is at 00:0c:29:73:39:c1"
"360","6.530194110","VMware_ed:58:af","VMware_48:a5:6d","ARP","60","Who has 192.168.100.12? Tell 192.168.100.14"
"361","6.530338838","VMware_48:a5:6d","VMware_ed:58:af","ARP","60","192.168.100.12 is at 00:0c:29:48:a5:6d"
"362","6.891465516","VMware_59:33:4b","VMware_50:3b:75","ARP","60","Who has 192.168.100.13? Tell 192.168.100.15"
"363","6.891574556","VMware_50:3b:75","VMware_59:33:4b","ARP","60","192.168.100.13 is at 00:0c:29:50:3b:75"
"364","7.403696107","VMware_59:33:4b","VMware_ed:58:af","ARP","60","Who has 192.168.100.14? Tell 192.168.100.15"
"365","7.403903619","VMware_ed:58:af","VMware_59:33:4b","ARP","60","192.168.100.14 is at 00:0c:29:ed:58:af"
